ID;AUTHORS;CATEGORY;TITLE1;Marx, Soru, Esteves, Ngonga Ngomo, Lehmann. ;Demo ;An Open Question Answering Framework2;Perera, Nand, Klette. ;Poster ;RealText-lex: A Lexicalization Framework for Linked Open Data3;Kim, Choi, Yi. ;Poster ;Improving Knowledge Validation using Objectivity and Corroborativeness of Web Resources4;Kimura, Kawamura, Watanabe, Matsumoto, Sato, Kushida, Matsumura. ;Poster ;J-GLOBAL knowledge: Japan's Largest Linked Open Data for Science and Technology6;Dragoni, Petrucci. ;Poster ;Supporting Multilingual Ontology Matching With MoKi7;Gao, Chen, Atzori, Gu, Zaniolo. ;Demo ;SPARQLT and its User-Friendly Interface for Managing and Querying the History of RDF Knowledge Bases9;Zhao, Ichise, Mita, Sasaki. ;Poster ;Core Ontologies for Safe Autonomous Driving10;Hur, Shin, Eom, Song, Lee. ;Poster ;Semantically Enriched IoT gateway for Wearable Devices11;Arcan, Asooja, Ziad, Buitelaar. ;Demo ;OTTO - Ontology Translation System14;Hu, Janowicz, Hitzler, Sengupta. ;Poster ;The Semantic Web Journal as Linked Data15;Saleem, Mehmood, Ngonga Ngomo. ;Demo ;Automatic SPARQL Benchmark Generation Using FEASIBLE16;Yao, Liu, Wang, Wei, Chen. ;Demo ;ANNA: Answering Why-Not Questions for SPARQL19;Vigo, Bellahsene, Ienco, Todorov. ;Demo ;Twitter Event Detection and Modeling with TEWS20;Saleem, Ali, Hogan, Mehmood, Ngonga Ngomo. ;Poster ;The LSQ Dataset: Querying for Queries21;Kotzyba, Ponomaryov, Low, Thiel, Glimm, Nürnberger. ;Demo ;Ontology-supported Exploratory Search for Physical Training Exercises22;Jimenez-Ruiz, Kharlamov, Zheleznyakov, Horrocks, Pinkel, Skjæveland, Thorstensen, Mora. ;Demo ;BootOX: Bootstrapping OWL 2 ontologies and R2RML mappings from Relational Databases23;Kharlamov, Brandt, Giese, Jimenez-Ruiz, Lamparter, Neuenstadt, Özcep, Pinkel, Soylu, Zheleznyakov, Roshchin, Watson, Horrocks. ;Demo ;Semantic Access to Siemens Streaming Data: the Optique Way24;Kharlamov, Jimenez-Ruiz, Pinkel, Rezk, Skjæveland, Soylu, Xiao, Zheleznyakov, Giese, Horrocks, Waaler. ;Demo ;Optique: Ontology-Based Data Access Platform25;Potoniec, Madziar. ;Poster ;Towards Memory-Efficient Answering of Tree-Shaped SPARQL Queries Using GPUs26;Roussakis, Chrysakis, Stefanidis, Flouris. ;Demo ;D2V: A Tool for Defining, Detecting and Visualizing Changes on the Data Web27;Darari, Prasojo, Nutt. ;Poster ;Expressing No-Value Information in RDF28;Colpaert, Llaves, Verborgh, Corcho, Mannens, Van de Walle. ;Demo ;Intermodal public transit routing using Linked Connections29;Farvardin, Kergosien, Roche, Teisseire. ;Demo ;A webtool for analyzing land-use planning documents32;Ben Ellefi, Bellahsene, Todorov. ;Demo ;Datavore: A Vocabulary Recommender Tool Assisting Linked Data Modeling33;Plu, Rizzo, Troncy. ;Poster ;An Experimental Study of a Hybrid Entity Recognition and Linking System34;Nguyen, Ichise. ;Poster ;ScSLINT: Time and Memory E_cient Interlinking Framework for Linked Data35;Nguyen, Ichise. ;Poster ;A Heuristic Approach for Conﬁguration Learning of Supervised Instance Matching36;Chawuthai, Takeda. ;Demo ;rSim: Simplifying an RDF Graph at the Visualization Tier for Non-Expert Users37;Tran, Um, Song. ;Poster ;Matrix Completion for Storm Damages Prediction39;Attard, Orlandi, Auer. ;Demo ;ExConQuer Framework - Softening RDF Data to Enhance Linked Data Reuse40;Wang, Feng, Rao, Wang, Zhang. ;Poster ;From Datalog Reasoning to Modular Structure of an Ontology41;Daga, Panziera, Pedrinaci. ;Demo ;BASIL: A Cloud Platform for Sharing and Reusing SPARQL Queries as Web APIs43;Saveta, Daskalaki, Flouris, Fundulaki, Ngonga Ngomo. ;Demo ;LANCE: A Generic Benchmark Generator for Linked Data45;Hyvönen, Tuominen, Ikkala, Mäkelä. ;Demo ;Ontology Services Based on Crowdsourcing: Case National Gazetteer of Historical Places46;Schäfer, Ristoski, Paulheim. ;Demo ;What is Special about Bethlehem, Pennsylvania? Identifying Unusual Facts about DBpedia Entities48;De Meester, De Nies, De Vocht, Verborgh, Mannens, Van de Walle. ;Demo ;StoryBlink: a Semantic Web Approach for Linking Stories49;Kondylakis, Koumakis, Psaraki, Troullinou, Chatzimina, Kazantzaki, Marias, Tsiknakis. ;Demo ;Semantically-enabled Personal Medical Information Recommender50;Hammar. ;Demo ;Ontology Design Patterns in WebProtégé52;Corcoglioniti, Palmero Aprosio, Rospocher. ;Demo ;Demonstrating the Power of Streaming and Sorting for Non-distributed RDF Processing: RDFpro53;Krafft. ;Poster ;Linked Data for Libraries: A Project Update54;Knuth, Lehmann, Kontokostas, Steiner, Sack. ;Poster ;The DBpedia Events Dataset55;Nam, Hahm, Nam, Choi. ;Poster ;SRDF: Korean Open Information Extraction using Singleton Property56;Soru, Marx, Ngonga Ngomo. ;Demo ;Enhancing Dataset Quality Using Keys57;De Vocht, Vander Sande, Van Herwegen, Verborgh, Mannens, Van de Walle. ;Demo ;The Highway to Queryable Linked Data: Self-Describing Web APIs with Varying Features58;Severo, Trojahn, Veira. ;Demo ;A GUI for visualising and manipulating multiple ontology alignments59;Bonte, Ongenae, Schaballie, Arndt, Leroux, Verborgh, Mannens, De Turck, Wauters. ;Poster ;Semantic Intelligence for Real-time Automated Media Production60;Jentzsch, Dullweber, Troiano, Naumann. ;Demo ;Exploring Linked Data Graph Structures61;Zhu, Wang, Shen. ;Poster ;Software.zhishi.schema: A Software Programming Taxonomy Derived from Stackoverflow62;Benedetti, Bergamaschi, Po. ;Demo ;LODeX: A tool for Visual Querying Linked Open Data63;Khan, Corson-Rikert, Zabel, Branchini, Degaetano.;Poster ;Curating and enabling discovery of New York State climate change science content using semantic web technologies 64;Hyvönen, Tuominen, Mäkelä, Dutruit, Apajalahti, Heino, Leskinen, Ikkala. ;Demo ;Second World War on the Semantic Web: The WarSampo Project and Semantic Portal66;Corcoglioniti, Rospocher, Palmero Aprosio. ;Demo ;Extracting Knowledge from Text with PIKES68;_er_ns, Ov_i__ikova, Zviedris. ;Demo ;SPARQL Aggregate Queries made easy with Diagrammatic Query Language ViziQuer69;Francisco Garcia Navarro, Antonio Lopez Villamar, Srinivasan, Perry, Das, Wu. ;Poster ;Exploring Large RDF Datasets using a Faceted Search70;Heyvaert, Dimou, Verborgh, Mannens, Van de Walle. ;Poster ;Towards Approaches for Generating RDF Mapping Definitions71;Fafalios, Tzitzikas. ;Demo ;SPARQL-LD: A SPARQL Extension for Fetching and Querying Linked Data72;Di Iorio, Nuzzolese, Osborne, Peroni, Poggi, Smith, Vitali, Zhao. ;Demo ;The RASH Framework: enabling HTML+RDF submissions in scholarly venues74;Debattista, Lange, Auer. ;Demo ;Luzzu -- A Framework for Linked Data Quality Assessment75;Achichi, Bailly, Cecconi, Destandau, Todorov, Troncy. ;Poster ;DOREMUS: Doing Reusable Musical Data76;Daga, D'Aquin, Gangemi, Motta. ;Demo ;Bottom-Up Ontology Construction with Contento77;Mouromtsev, Pavlov, Emelyanov, Morozov, Razdyakonov, Galkin. ;Demo ;The simple, web-based tool for visualization and sharing of semantic data and ontologies78;Wood. ;Poster ;Semantic Composition of Disparate Data in GeoHealthUS for Navigation, Display and Analysis79;Troullinou, Kondylakis, Daskalaki, Plexousakis. ;Demo ;RDF Digest: Ontology Exploration Using Summaries80;Aggarwal, Asooja, Jha, Buitelaar. ;Poster ;Top-N Books Recommendation Using Wikipedia81;Aggarwal, Mika, Blanco, Buitelaar. ;Poster ;Leveraging Wikipedia Knowledge for Entity Recommendations82;Aggarwal, Barker, Welty. ;Poster ;Medical Concept Resolution83;Ferguson, Vardeman.;Poster ;Relative Relationship ODP: Scaling Case84;Koutraki, Vodislav, Preda. ;Demo ;DORIS: Discovering Ontological Relations In Services85;Gentile, Nuzzolese. ;Poster ;cLODg - Conference Linked Open Data Generator86;Sana E Zainab, Saleem, Mehmood, Zehra, Decker, Hasnain. ;Demo ;SPARQL Query Formulation and Execution using FedViz87;Song, Schilder, Smiley, Brew, Zielund, Bretz, Martin, Dale, Pomerville, Duprey, Miller, Harrison. ;Demo ;TR Discover: A Natural Language Question Answering System for Interlinked Datasets88;Szekely, Knoblock, Slepicka, Yin, Philpot, Singh, Kapoor, Natarajan, Marcu, Knight, Stallard, Karunamoorthy, Bojanapalli, Minton, Amanatullah, Hughes, Tamayo, Flynt, Artiss, Chang, Chen, Hiebel, Ferreira. ;Demo ;Demonstration Paper: Using a Knowledge Graph to Combat Human Trafficking89;Huo, Nabrzyski, Vardeman. ;Poster ;Smart Container: an ontology towards conceptualizing Docker91;Seyed, Patton, Subotin. ;Poster ;Crowdsourcing for ICD10 Code to Concept Relationships92;Pappachan, Yus, Das, Mehrotra, Finin, Joshi. ;Poster ;Mobipedia: Mobile Applications Linked Data94;Miyazaki, Urakawa, Yamada, Miura, Miyazaki, Fujisawa, Nakagawa. ;Demo ;My Health Dictionary: Study on Web Service using Program Information Data-hub as Linked Open Data95;Mauri, Calbimonte, Dell'Aglio, Balduini, Della Valle, Aberer. ;Poster ;Where are the RDF Streams?: On Deploying RDF Streams on the Web of Data with TripleWave96;Belk, Wohlgenannt, Polleres. ;Poster ;Exploring and Exploiting(?) the Awkward Connections Between SKOS and OWL97;Yus, Mena. ;Poster ;Mobile Endpoints: Accessing Dynamic Information from Mobile Devices99;Krisnadhi, Hu, Janowicz, Hitzler, Arko, Carbotte, Chandler, Cheatham, Fils, Finin, Ji, Jones, Karima, Lehnert, Mickle, Narock, O'Brien, Raymond, Shepherd, Schildhauer, Wiebe. ;Poster ;The GeoLink Framework for Pattern-based Linked Data Integration100;Curé, Naacke, Baazizi, Amann.  ;Poster;HAQWA: a Hash-based and Query Workload Aware Distributed RDF Store101;Dastgheib, Mcskimming, Natarajan, Kochut. ;Demo ;SPARQLing: A Graphical Interface for SPARQL102;Esteves, Moussallem, Baron Neto, Lehmann, Reis Cavalcanti, Duarte. ;Demo ;Interoperable Machine Learning Metadata using MEX103;Ruan, Dong, Li, Wang. ;Demo ;KBMetrics - A Multi-purpose tool for Measuring Quality of Linked Open Data Sets104;Costa, Knorr, Leite. ;Demo ;Querying LUBM with Non-monotonic Features in Protégé using NoHR105;Sequeda, Miranker. ;Demo;Ultrawrap Mapper: A Semi-Automatic Relational Database to RDF (RDB2RDF) Mapping Tool106;Aydar, Melton. ;Poster ;Translation of Instance Data using RDF and Structured Mapping Definitions107;Wang, Feng, Rao, Wang, Zhang. ;Poster ;Updating Direct Graph for Incremental reasoning in OWL 2 QL Ontology108;Dimou, Kontokostas, Freudenberg, Verborgh, Lehmann, Mannens, Hellmann, Van de Walle. ;Poster ;Test-driven Assessment of [R2]RML Mappings to Improve Dataset Quality109;Exeler, Waitelonis, Sack.;Poster;Linked Data Annotated Document Retrieval110;Syed, Han, Rahman, Finin, Kukla, Yun. ;Poster ;Querying Large Linked Data Resources 111;Mehdi, Khan, Freitas, Alves Chaves, Hasapis, Sahay. ;Demo ;Demonstrating a Linked Data Platform for Finite Element Biosimulations of Cochlear Mechanics112;Nargesian, Biem, Jain, Parthasarathy, Turaga.;Demo ;SOFIA: An Analytics Recommendation System 113;Mihindukulasooriya, Poveda-Villalón, García-Castro, Gómez-Pérez. ;Demo ;Loupe - An Online Tool for Inspecting Datasets in the Linked Data Cloud114;Hassanzadeh, Miller, Nargesian, Zhu. ;Demo ;LinkedCT Live: Platform for Online Curation of Clinical Trials Data 115;Corsar, Markovic, Gault, Mehdi, Edwards, Nelson, Cottrill, Sripada. ;Demo ;TravelBot: Journey Disruption Alerts Utilising Social Media and Linked Data117;Liebig, Vialard, Opitz, Metzl. ;Demo ;GraphScale: Adding Expressive Reasoning to Semantic Data Stores124;Endris, Faisal, Orlandi, Auer, Scerri.;Poster;iRap -- An Interest-Based RDF Update Propagation Framework126;Di Noia. ;Demo ;LOSM: a SPARQL endpoint to query Open Street Map